[
  {
    "id": "andragogika-a-gerontagogika-ve-specialni-pedagogice",
    "title": "Andragogika, gerontagogika a speciální andragogika",
    "didacticGoal": "Usadit terminologický vývoj vzdělávání dospělých a seniorů v návaznosti na speciální pedagogiku.",
    "disciplineIds": [
      "andragogika-a-gerontagogika"
    ],
    "eraIds": [
      "19-stoleti",
      "20-stoleti",
      "20-21-stoleti"
    ],
    "steps": [
      {
        "id": "kapp",
        "entityId": "alexandr-kapp",
        "role": "entry"
      },
      {
        "id": "kehrer",
        "entityId": "ferdinand-adalbert-kehrer",
        "role": "bridge"
      },
      {
        "id": "bollnow",
        "entityId": "otto-friedrich-bollnow",
        "role": "bridge"
      },
      {
        "id": "livecka",
        "entityId": "emil-livecka",
        "role": "bridge"
      },
      {
        "id": "muhlpachr",
        "entityId": "pavel-muhlpachr",
        "role": "milestone"
      },
      {
        "id": "langer",
        "entityId": "jiri-langer",
        "role": "target"
      }
    ],
    "requiredNodeIds": [
      "alexandr-kapp",
      "ferdinand-adalbert-kehrer",
      "emil-livecka",
      "pavel-muhlpachr",
      "jiri-langer"
    ],
    "contrastMoments": [
      {
        "id": "terminologie-dospelost-stari",
        "title": "Andragogika a gerontagogika",
        "focusEntityIds": [
          "andragogika",
          "gerontagogika",
          "specialni-andragogika"
        ],
        "question": "Jak se ve zdroji liší terminologické počátky andragogiky, geragogiky a současné speciální andragogiky?"
      }
    ],
    "recommendedDifficulty": "introductory",
    "sourceReferences": [
      {
        "sourceDocumentId": "mini-wikipedie-osobnosti-vs",
        "locator": "Jiří Langer",
        "excerpt": "Je důležitý pro vymezení speciální andragogiky jako samostatné aplikační oblasti oboru."
      }
    ]
  },
  {
    "id": "ceska-somatopedicka-tradice",
    "title": "Česká somatopedická a rehabilitační tradice",
    "didacticGoal": "Propojit institucionální, rehabilitační a výchovně-pracovní linii české somatopedie.",
    "disciplineIds": [
      "somatopedie"
    ],
    "eraIds": [
      "19-20-stoleti",
      "20-stoleti"
    ],
    "steps": [
      {
        "id": "jedlicka",
        "entityId": "rudolf-jedlicka",
        "role": "entry"
      },
      {
        "id": "bakule",
        "entityId": "frantisek-bakule",
        "role": "bridge"
      },
      {
        "id": "mauer",
        "entityId": "jan-mauer",
        "role": "contrast"
      },
      {
        "id": "jan-chlup",
        "entityId": "jan-chlup",
        "role": "bridge"
      },
      {
        "id": "monatova",
        "entityId": "lili-monatova",
        "role": "target"
      }
    ],
    "requiredNodeIds": [
      "rudolf-jedlicka",
      "frantisek-bakule",
      "jan-mauer",
      "lili-monatova"
    ],
    "contrastMoments": [
      {
        "id": "jedlicka-bakule",
        "title": "Instituce a výchova prací",
        "focusEntityIds": [
          "rudolf-jedlicka",
          "frantisek-bakule"
        ],
        "question": "Jak se liší Jedličkův ústav a Bakulův ústav v akcentu léčby, edukace a výchovy prací?"
      }
    ],
    "recommendedDifficulty": "introductory",
    "sourceReferences": [
      {
        "sourceDocumentId": "mini-wikipedie-osobnosti-vs",
        "locator": "Rudolf Jedlička",
        "excerpt": "Spojil léčbu, edukaci, rehabilitaci a přípravu na pracovní život."
      }
    ]
  },
  {
    "id": "ceske-vymezeni-specialni-pedagogiky",
    "title": "České vymezování speciální pedagogiky",
    "didacticGoal": "Projít proměnu českého vymezování oboru od humanistického předpolí přes terminologické a kategoriální pojetí k současnému funkčně orientovanému modelu.",
    "disciplineIds": [
      "specialni-pedagogika-a-dejiny-oboru"
    ],
    "eraIds": [
      "17-stoleti",
      "20-stoleti",
      "20-21-stoleti"
    ],
    "steps": [
      {
        "id": "komensky",
        "entityId": "jan-amos-komensky",
        "role": "entry",
        "prompt": "Začni u humanistického předpolí vzdělavatelnosti."
      },
      {
        "id": "popelar",
        "entityId": "bohumir-justyn-popelar",
        "role": "bridge",
        "prompt": "Sleduj terminologický přechod od defektologie ke speciální pedagogice."
      },
      {
        "id": "dvorak",
        "entityId": "karel-dvorak",
        "role": "contrast",
        "prompt": "Porovnej užší kategoriální vymezení oboru."
      },
      {
        "id": "vitkova",
        "entityId": "marie-vitkova",
        "role": "bridge",
        "prompt": "Přesuň se k integrativnímu a inkluzivnímu pojetí."
      },
      {
        "id": "fischer",
        "entityId": "slavomir-fischer",
        "role": "target",
        "prompt": "Uzavři trasu současným širším funkčně orientovaným vymezením."
      }
    ],
    "requiredNodeIds": [
      "jan-amos-komensky",
      "karel-dvorak",
      "bohumir-justyn-popelar",
      "marie-vitkova",
      "slavomir-fischer"
    ],
    "contrastMoments": [
      {
        "id": "dvorak-vs-soucasnost",
        "title": "Starší a současné pojetí",
        "focusEntityIds": [
          "karel-dvorak",
          "slavomir-fischer",
          "jiri-skoda",
          "josef-slowik"
        ],
        "question": "Které jméno reprezentuje starší kategoriální vymezení a která jména širší podpůrný model?"
      }
    ],
    "recommendedDifficulty": "intermediate",
    "sourceReferences": [
      {
        "sourceDocumentId": "mini-wikipedie-osobnosti-vs",
        "locator": "Karel Dvořák",
        "excerpt": "Ve studiu je důležitý jako kontrast k novějším definicím."
      }
    ]
  },
  {
    "id": "dejiny-autismu-ve-zdroji",
    "title": "Dějiny autismu ve zdrojovém přehledu",
    "didacticGoal": "Seřadit jména, která zdroj používá pro historickou a současnou orientaci v PAS.",
    "disciplineIds": [
      "psychologie-psychiatrie-a-psychoterapie"
    ],
    "eraIds": [
      "20-stoleti",
      "20-21-stoleti"
    ],
    "steps": [
      {
        "id": "kanner",
        "entityId": "leo-kanner",
        "role": "entry"
      },
      {
        "id": "asperger",
        "entityId": "hans-asperger",
        "role": "bridge"
      },
      {
        "id": "wing",
        "entityId": "lorna-wingova",
        "role": "milestone"
      },
      {
        "id": "thorova",
        "entityId": "katerina-thorova",
        "role": "target"
      }
    ],
    "requiredNodeIds": [
      "leo-kanner",
      "hans-asperger",
      "lorna-wingova",
      "katerina-thorova"
    ],
    "contrastMoments": [
      {
        "id": "autismus-historie",
        "title": "Od klinického popisu ke spektru",
        "focusEntityIds": [
          "leo-kanner",
          "hans-asperger",
          "lorna-wingova"
        ],
        "question": "Která jména patří k prvním klinickým popisům a které ke spektrálnímu chápání autismu?"
      }
    ],
    "recommendedDifficulty": "introductory",
    "sourceReferences": [
      {
        "sourceDocumentId": "mini-wikipedie-osobnosti-vs",
        "locator": "Lorna Wingová",
        "excerpt": "Je důležitá pro modernější spektrální chápání autismu."
      }
    ]
  },
  {
    "id": "dejiny-edukace-nevidomych-a-hluchoslepych",
    "title": "Dějiny edukace nevidomých a hluchoslepých",
    "didacticGoal": "Sledovat vývoj institucí, písem a přístupů od raného předpolí tyflopedie po moderní technické a institucionální opory.",
    "disciplineIds": [
      "tyflopedie"
    ],
    "eraIds": [
      "stredovek-a-rane-predpoli",
      "18-stoleti",
      "19-stoleti",
      "19-20-stoleti",
      "20-21-stoleti"
    ],
    "steps": [
      {
        "id": "al-amidi",
        "entityId": "arab-al-amidi",
        "role": "entry"
      },
      {
        "id": "diderot",
        "entityId": "denis-diderot",
        "role": "bridge"
      },
      {
        "id": "hauy",
        "entityId": "valentin-hauy",
        "role": "milestone"
      },
      {
        "id": "barbier",
        "entityId": "josef-julius-barbier",
        "role": "bridge"
      },
      {
        "id": "braille",
        "entityId": "louis-braille",
        "role": "target"
      },
      {
        "id": "howe",
        "entityId": "samuel-gridley-howe",
        "role": "bridge"
      },
      {
        "id": "laura",
        "entityId": "laura-bridgman",
        "role": "bridge"
      },
      {
        "id": "keller",
        "entityId": "helen-keller",
        "role": "target"
      }
    ],
    "requiredNodeIds": [
      "valentin-hauy",
      "josef-julius-barbier",
      "louis-braille",
      "samuel-gridley-howe",
      "laura-bridgman",
      "helen-keller"
    ],
    "contrastMoments": [
      {
        "id": "predbraillske-systemy",
        "title": "Předbraillské systémy",
        "focusEntityIds": [
          "josef-julius-barbier",
          "thomas-mark-lucas",
          "william-moon"
        ],
        "question": "Který systém je přímým předstupněm Braillova písma a které jsou alternativní reliéfní soustavy?"
      },
      {
        "id": "howe-bridgman-keller",
        "title": "Linie hluchoslepoty",
        "focusEntityIds": [
          "samuel-gridley-howe",
          "laura-bridgman",
          "helen-keller"
        ],
        "question": "Jak na sebe navazují jména Howe, Bridgman a Keller?"
      }
    ],
    "recommendedDifficulty": "advanced",
    "sourceReferences": [
      {
        "sourceDocumentId": "mini-wikipedie-osobnosti-vs",
        "locator": "Louis Braille",
        "excerpt": "Braillovo písmo zásadně změnilo možnosti samostatného čtení, psaní a vzdělávání nevidomých."
      }
    ]
  },
  {
    "id": "dejiny-logopedie-od-neurologie-k-aak",
    "title": "Od neurologických základů k AAK v logopedii",
    "didacticGoal": "Spojit neurologické, klinické a komunikační linie logopedie do jedné studijní osy.",
    "disciplineIds": [
      "logopedie"
    ],